{"authority":{"deployment_authorized":false,"production_approved":false,"provider_actions_performed":0,"provider_transport_authorized":false},"execution_policy":{"authentication_mutation":false,"delegation":false,"maximum_calls":3,"mcp":false,"memory":false,"retries":0,"stop_on_invalid_output":true,"tools":false},"input_hashes":{"blueprint":"sha256:ebad2d381be662a6ef4b6061776a74d6e3c5a38a2d948305e1903dbb3f09564f","owner_brief":"sha256:bc6fa289b4cd0ba57ceb8333c306b209a6e238e8af949e553b04203476bd4c0d"},"mission_id":"draft-ava-home-services-concierge-20260826-014140-bb4a8c","model":"gpt-5.6-luna","provider":"openai-codex","schema_version":"0.1","stages":[{"input":"owner_brief","job":"Confirm that the normalized owner intent and boundaries remain faithful to the submitted brief.","output_contract":"normalized_intake.v0.2","profile":"atlas","sequence":1},{"input":"atlas_output_plus_blueprint","job":"Review module selection, conversation design, and implementation completeness without adding unsupported facts.","output_contract":"x_agent_blueprint.v0.2","profile":"aria","sequence":2},{"input":"aria_output_plus_x_link_candidate","job":"Independently inspect intent fidelity, testability, evidence boundaries, and X-Link handoff readiness.","output_contract":"evaluation_contract.v0.1","profile":"vera","sequence":3}],"status":"PREPARED_NOT_TRANSMITTED"}
